" Larry Watkinson ","Fire Chief",250-490-2309,larry.watkinson@penticton.ca
" Judy Watling ","Acting Executive Head",613-947-3912,questions@horizons.gc.ca
" Marie Watmough ","Manager of Legislative Services","(250) 478-7882",mwatmough@langford.ca
"Marie Watmough ","Manager of Legislative Services","(250) 478-7882",mwatmough@langford.ca
" Monique Watson ","Manager of Financial Services",2506560781,mwatson@northsaanich.ca
" Lorie Watson ","Economic Development Officer",250-692-7587,edo@burnslake.ca
" Lou-Ann Watson ","Director of Public Works",250-774-2541,lwatson@northernrockies.ca
" Oliver Watson ","Superintendent of Public Works","(250) 752-6921",owatson@qualicumbeach.com
" Ken Watson ","Acting Director of Engineering and Public Works","(250) 720-2838",ken_watson@portalberni.ca
" Aimee Watson ","Director - Electoral Area D","(250) 304-5842",awatson@rdck.bc.ca
